{
  "id": "throughput",
  "title": "Throughput",
  "domain": [
    "Systems",
    "Operations"
  ],
  "bodies": {
    "intuition": "How much work finishes per second, as opposed to how long any one piece takes. A serving system can be excellent at one and dismal at the other, and improving one usually costs the other — choosing where to sit on that trade is most of what serving engineering is.",
    "engineer": "The unit is where the arguments happen and it is usually left vague. Tokens per second across all requests, requests per second, and tokens per second for one user are three different quantities, and a system tuned for the first can be miserable on the third. Batching is the mechanism behind all of it: a larger batch raises aggregate tokens per second and raises what each request waits, so a throughput number quoted without the batch size and the latency it bought has not said anything.",
    "math": "Throughput rises with batch size only while the work is memory-bound: the weights have to be read either way, so extra requests ride the same read and the step takes barely longer. That is what makes batching nearly free in this regime — free in step time, which is the part of a request's latency the batch size controls. Once the arithmetic per byte loaded saturates the accelerator that stops, and step time grows in proportion to the batch: throughput flattens while latency begins rising linearly. So the trade is not smooth, and past saturation it is all cost. The batch size where it turns is the one number worth measuring, and it belongs to the model and the accelerator together rather than to either alone."
  },
  "emphasis": {
    "engineer": "a throughput number quoted without the batch size and the latency it bought has not said anything",
    "math": "past saturation it is all cost"
  },
  "viz": {
    "primitive": "budget-split",
    "params": {
      "compute_time": 20,
      "share_rest": 40
    },
    "param_controls": [
      {
        "name": "compute_time",
        "min": 0,
        "max": 400,
        "step": 20
      }
    ],
    "caption": "Time the accelerator spends on arithmetic, against time it spends stalled waiting for memory, in equal units. Drag the compute time up — batch size is what moves it in practice — to watch the stall shrink; once it has, more batch buys latency and no throughput at all."
  },
  "edges": {
    "requires": [
      {
        "id": "continuous-batching",
        "reviewed": false
      }
    ],
    "adjacent": [
      {
        "id": "tail-latency",
        "reviewed": false
      },
      {
        "id": "accelerator-utilization",
        "reviewed": false
      }
    ]
  },
  "citations": [
    {
      "ref": "arXiv:2309.06180",
      "title": "Efficient Memory Management for Large Language Model Serving with PagedAttention",
      "url": "https://arxiv.org/abs/2309.06180"
    },
    {
      "ref": "arXiv:2211.05102",
      "title": "Efficiently Scaling Transformer Inference",
      "url": "https://arxiv.org/abs/2211.05102"
    }
  ],
  "updated_at": "2026-09-07",
  "explainers": [
    {
      "kind": "read",
      "scope": "domain",
      "title": "How to Train Really Large Models on Many GPUs?",
      "author": "Lilian Weng",
      "url": "https://lilianweng.github.io/posts/2021-09-25-train-large/"
    }
  ],
  "review": {
    "reviewed_by": "opendroid",
    "reviewed_at": "2026-09-07"
  }
}
