{
  "id": "loss-function",
  "title": "Loss Function",
  "domain": [
    "Optimization",
    "Objectives"
  ],
  "bodies": {
    "intuition": "Training needs a single number saying how wrong the model currently is. The loss function produces it. Everything else — gradients, updates, the entire training run — is machinery for pushing that number down, so the choice of what it measures is the choice of what the model becomes good at.",
    "engineer": "Map a prediction and a target to a scalar, differentiable almost everywhere so a gradient exists. It is a proxy, not the goal: nobody wants low cross-entropy, they want a useful model, and the gap between the two is where most surprising training behaviour lives. Loss going down while the thing you care about stagnates is the normal case, not a bug.",
    "math": "L(θ) = (1/N) Σ_i ℓ(f_θ(x_i), y_i) for a per-example loss ℓ. Training seeks argmin_θ L, but only the empirical L over the training set is observable; the quantity that matters is the expectation over the true distribution, which is never computed."
  },
  "emphasis": {
    "intuition": "the choice of what the model becomes good at",
    "engineer": "It is a proxy, not the goal"
  },
  "viz": {
    "primitive": "loss-curve",
    "params": {
      "steps": 1000,
      "lr": 0.001
    },
    "param_controls": [],
    "caption": "Loss against training step, falling fast and then slowly — most of the total improvement arrives in the first fraction of the run."
  },
  "edges": {
    "requires": [],
    "adjacent": []
  },
  "citations": [
    {
      "ref": "arXiv:1611.03530",
      "title": "Understanding deep learning requires rethinking generalization",
      "url": "https://arxiv.org/abs/1611.03530"
    }
  ],
  "updated_at": "2026-08-02",
  "explainers": [
    {
      "kind": "read",
      "scope": "domain",
      "title": "Optimization and Deep Learning",
      "author": "Zhang, Lipton, Li & Smola",
      "url": "https://d2l.ai/chapter_optimization/optimization-intro.html"
    }
  ],
  "review": {
    "reviewed_by": "opendroid",
    "reviewed_at": "2026-08-04"
  }
}
