{
  "id": "latent-diffusion",
  "title": "Latent Diffusion",
  "domain": [
    "Multimodal",
    "Generation"
  ],
  "bodies": {
    "intuition": "Running diffusion on raw pixels is enormously expensive, and most pixels carry no information anyone would miss. Latent diffusion compresses the image first with an autoencoder, runs the whole noising and denoising process in that much smaller space, and decodes only at the end. The same model becomes affordable to train and fast enough to serve.",
    "engineer": "An autoencoder trained once maps images to a latent grid perhaps eight times smaller per side; diffusion then operates entirely there. Text conditioning enters through cross-attention in the denoising network. This is the architecture behind the open image generators, and the compression factor is the single parameter that decides whether it runs on consumer hardware.",
    "math": "A downsampling factor f reduces the spatial grid by f² and the per-step cost by roughly f² — at f = 8 that is sixty-four times less work per denoising step. The autoencoder is trained once and frozen, so the cost is paid once rather than per sample."
  },
  "emphasis": {
    "intuition": "most pixels carry no information anyone would miss",
    "engineer": "the compression factor is the single parameter that decides whether it runs on consumer hardware"
  },
  "viz": {
    "primitive": "budget-split",
    "params": {
      "latent_cells": 8,
      "share_rest": 56
    },
    "param_controls": [
      {
        "name": "latent_cells",
        "min": 4,
        "max": 64,
        "step": 4
      }
    ],
    "caption": "The latent grid a denoising step works on, against the pixel grid compression removed — both as cells along a side. Drag the latent size to watch the saving shrink."
  },
  "edges": {
    "requires": [
      {
        "id": "diffusion-model",
        "reviewed": false
      },
      {
        "id": "cross-attention",
        "reviewed": false
      }
    ],
    "adjacent": []
  },
  "citations": [
    {
      "ref": "arXiv:2112.10752",
      "title": "High-Resolution Image Synthesis with Latent Diffusion Models",
      "url": "https://arxiv.org/abs/2112.10752"
    },
    {
      "ref": "arXiv:1711.00937",
      "title": "Neural Discrete Representation Learning",
      "url": "https://arxiv.org/abs/1711.00937"
    }
  ],
  "updated_at": "2026-08-04",
  "explainers": [
    {
      "kind": "read",
      "scope": "concept",
      "title": "What are Diffusion Models?",
      "author": "Lilian Weng",
      "url": "https://lilianweng.github.io/posts/2021-07-11-diffusion-models/"
    },
    {
      "kind": "video",
      "scope": "domain",
      "title": "Contrastive Learning - 5 Minutes with Cyrill",
      "author": "Cyrill Stachniss",
      "url": "https://www.youtube.com/watch?v=sftIkJ8MYL4"
    }
  ],
  "review": {
    "reviewed_by": "opendroid",
    "reviewed_at": "2026-08-04"
  }
}
